<?xml version="1.0" encoding="UTF-8"?>
<MAGAZINEissueGTS xmlns="http://www.factminers.org/MAGAZINE/gts/2017-02-14"
	xmlns:xsi="http://www.w3.org/2001/XMLSchema-instance"
	xsi:schemaLocation="http://www.factminers.org/MAGAZINE/gts/2017-02-14 http://www.factminers.org/MAGAZINE/gts/2017-02-14/factminers_magazine_issue_gts_schema.xsd"
	MAGAZINEissueGTS_Id="softalkv4n11jul1984">
	<Metadata>
		<Creator>FactMiners and The Softalk Apple Project</Creator>
		<Created>2017-02-14T12:00:00</Created>
		<LastChange>2017-02-14T12:00:00</LastChange>
		<Comment>MAGAZINE Ground Truth Storage for softalkv4n11jul1984 of the 48-issue run of Softalk Magazine.</Comment>
	</Metadata>
	<DocumentStructure>
		<Comment> This branch of the MAGAZINE #GTS format provides the metamodel and associated datasets
			that describe the complex document structure of this ISSUE of a magazine (or other serial publication). </Comment>
		<DataSets>
			<ppg2leaf_map>
				<leaf leafnum="1">
					<pageNum>Cover1</pageNum>
					<ocr_ppg>None</ocr_ppg>
					<validation>inferred</validation>
					<pgType>Cover</pgType>
					<handSide>RIGHT</handSide>
					<issue_id>softalkv4n11jul1984</issue_id>
					<validated_on>02/26/17 10:23:57 -0700</validated_on>
					<validator>Jim Salmons and Timlynn Babitsky</validator>
				</leaf>
				<leaf leafnum="2">
					<pageNum>Cover2</pageNum>
					<ocr_ppg>None</ocr_ppg>
					<validation>inferred</validation>
					<pgType>Normal</pgType>
					<handSide>LEFT</handSide>
					<issue_id>softalkv4n11jul1984</issue_id>
					<validated_on>02/26/17 10:23:59 -0700</validated_on>
					<validator>Jim Salmons and Timlynn Babitsky</validator>
				</leaf>
				<leaf leafnum="3">
					<pageNum>1</pageNum>
					<ocr_ppg>3</ocr_ppg>
					<validation>inferred</validation>
					<pgType>Normal</pgType>
					<handSide>RIGHT</handSide>
					<issue_id>softalkv4n11jul1984</issue_id>
					<validated_on>02/26/17 10:24:07 -0700</validated_on>
					<validator>Jim Salmons and Timlynn Babitsky</validator>
				</leaf>
				<leaf leafnum="4">
					<pageNum>2</pageNum>
					<ocr_ppg>None</ocr_ppg>
					<validation>inferred</validation>
					<pgType>Contents</pgType>
					<handSide>LEFT</handSide>
					<issue_id>softalkv4n11jul1984</issue_id>
					<validated_on>02/26/17 10:24:09 -0700</validated_on>
					<validator>Jim Salmons and Timlynn Babitsky</validator>
				</leaf>
				<leaf leafnum="5">
					<pageNum>3</pageNum>
					<ocr_ppg>None</ocr_ppg>
					<validation>inferred</validation>
					<pgType>Contents</pgType>
					<handSide>RIGHT</handSide>
					<issue_id>softalkv4n11jul1984</issue_id>
					<validated_on>02/26/17 10:24:11 -0700</validated_on>
					<validator>Jim Salmons and Timlynn Babitsky</validator>
				</leaf>
				<leaf leafnum="6">
					<pageNum>4</pageNum>
					<ocr_ppg>4</ocr_ppg>
					<validation>printed</validation>
					<pgType>Normal</pgType>
					<handSide>LEFT</handSide>
					<issue_id>softalkv4n11jul1984</issue_id>
					<validated_on>02/26/17 10:24:12 -0700</validated_on>
					<validator>Jim Salmons and Timlynn Babitsky</validator>
				</leaf>
				<leaf leafnum="7">
					<pageNum>5</pageNum>
					<ocr_ppg>7</ocr_ppg>
					<validation>inferred</validation>
					<pgType>Normal</pgType>
					<handSide>RIGHT</handSide>
					<issue_id>softalkv4n11jul1984</issue_id>
					<validated_on>02/26/17 10:24:14 -0700</validated_on>
					<validator>Jim Salmons and Timlynn Babitsky</validator>
				</leaf>
				<leaf leafnum="8">
					<pageNum>6</pageNum>
					<ocr_ppg>6</ocr_ppg>
					<validation>printed</validation>
					<pgType>Normal</pgType>
					<handSide>LEFT</handSide>
					<issue_id>softalkv4n11jul1984</issue_id>
					<validated_on>02/26/17 10:24:15 -0700</validated_on>
					<validator>Jim Salmons and Timlynn Babitsky</validator>
				</leaf>
				<leaf leafnum="9">
					<pageNum>7</pageNum>
					<ocr_ppg>None</ocr_ppg>
					<validation>inferred</validation>
					<pgType>Normal</pgType>
					<handSide>RIGHT</handSide>
					<issue_id>softalkv4n11jul1984</issue_id>
					<validated_on>02/26/17 10:24:17 -0700</validated_on>
					<validator>Jim Salmons and Timlynn Babitsky</validator>
				</leaf>
				<leaf leafnum="10">
					<pageNum>8</pageNum>
					<ocr_ppg>8</ocr_ppg>
					<validation>printed</validation>
					<pgType>Normal</pgType>
					<handSide>LEFT</handSide>
					<issue_id>softalkv4n11jul1984</issue_id>
					<validated_on>02/26/17 10:24:18 -0700</validated_on>
					<validator>Jim Salmons and Timlynn Babitsky</validator>
				</leaf>
				<leaf leafnum="11">
					<pageNum>9</pageNum>
					<ocr_ppg>None</ocr_ppg>
					<validation>inferred</validation>
					<pgType>Normal</pgType>
					<handSide>RIGHT</handSide>
					<issue_id>softalkv4n11jul1984</issue_id>
					<validated_on>02/26/17 10:24:19 -0700</validated_on>
					<validator>Jim Salmons and Timlynn Babitsky</validator>
				</leaf>
				<leaf leafnum="12">
					<pageNum>10</pageNum>
					<ocr_ppg>None</ocr_ppg>
					<validation>inferred</validation>
					<pgType>Normal</pgType>
					<handSide>LEFT</handSide>
					<issue_id>softalkv4n11jul1984</issue_id>
					<validated_on>02/26/17 10:24:20 -0700</validated_on>
					<validator>Jim Salmons and Timlynn Babitsky</validator>
				</leaf>
				<leaf leafnum="13">
					<pageNum>11</pageNum>
					<ocr_ppg>11</ocr_ppg>
					<validation>printed</validation>
					<pgType>Normal</pgType>
					<handSide>RIGHT</handSide>
					<issue_id>softalkv4n11jul1984</issue_id>
					<validated_on>02/26/17 10:24:22 -0700</validated_on>
					<validator>Jim Salmons and Timlynn Babitsky</validator>
				</leaf>
				<leaf leafnum="14">
					<pageNum>12</pageNum>
					<ocr_ppg>12</ocr_ppg>
					<validation>printed</validation>
					<pgType>Normal</pgType>
					<handSide>LEFT</handSide>
					<issue_id>softalkv4n11jul1984</issue_id>
					<validated_on>02/26/17 10:24:23 -0700</validated_on>
					<validator>Jim Salmons and Timlynn Babitsky</validator>
				</leaf>
				<leaf leafnum="15">
					<pageNum>13</pageNum>
					<ocr_ppg>None</ocr_ppg>
					<validation>inferred</validation>
					<pgType>Normal</pgType>
					<handSide>RIGHT</handSide>
					<issue_id>softalkv4n11jul1984</issue_id>
					<validated_on>02/26/17 10:24:24 -0700</validated_on>
					<validator>Jim Salmons and Timlynn Babitsky</validator>
				</leaf>
				<leaf leafnum="16">
					<pageNum>14</pageNum>
					<ocr_ppg>14</ocr_ppg>
					<validation>printed</validation>
					<pgType>Normal</pgType>
					<handSide>LEFT</handSide>
					<issue_id>softalkv4n11jul1984</issue_id>
					<validated_on>02/26/17 10:24:25 -0700</validated_on>
					<validator>Jim Salmons and Timlynn Babitsky</validator>
				</leaf>
				<leaf leafnum="17">
					<pageNum>15</pageNum>
					<ocr_ppg>None</ocr_ppg>
					<validation>inferred</validation>
					<pgType>Normal</pgType>
					<handSide>RIGHT</handSide>
					<issue_id>softalkv4n11jul1984</issue_id>
					<validated_on>02/26/17 10:24:26 -0700</validated_on>
					<validator>Jim Salmons and Timlynn Babitsky</validator>
				</leaf>
				<leaf leafnum="18">
					<pageNum>16</pageNum>
					<ocr_ppg>16</ocr_ppg>
					<validation>printed</validation>
					<pgType>Normal</pgType>
					<handSide>LEFT</handSide>
					<issue_id>softalkv4n11jul1984</issue_id>
					<validated_on>02/26/17 10:24:28 -0700</validated_on>
					<validator>Jim Salmons and Timlynn Babitsky</validator>
				</leaf>
				<leaf leafnum="19">
					<pageNum>17</pageNum>
					<ocr_ppg>None</ocr_ppg>
					<validation>inferred</validation>
					<pgType>Normal</pgType>
					<handSide>RIGHT</handSide>
					<issue_id>softalkv4n11jul1984</issue_id>
					<validated_on>02/26/17 10:24:29 -0700</validated_on>
					<validator>Jim Salmons and Timlynn Babitsky</validator>
				</leaf>
				<leaf leafnum="20">
					<pageNum>18</pageNum>
					<ocr_ppg>None</ocr_ppg>
					<validation>inferred</validation>
					<pgType>Normal</pgType>
					<handSide>LEFT</handSide>
					<issue_id>softalkv4n11jul1984</issue_id>
					<validated_on>02/26/17 10:24:31 -0700</validated_on>
					<validator>Jim Salmons and Timlynn Babitsky</validator>
				</leaf>
				<leaf leafnum="21">
					<pageNum>19</pageNum>
					<ocr_ppg>None</ocr_ppg>
					<validation>inferred</validation>
					<pgType>Normal</pgType>
					<handSide>RIGHT</handSide>
					<issue_id>softalkv4n11jul1984</issue_id>
					<validated_on>02/26/17 10:24:33 -0700</validated_on>
					<validator>Jim Salmons and Timlynn Babitsky</validator>
				</leaf>
				<leaf leafnum="22">
					<pageNum>20</pageNum>
					<ocr_ppg>None</ocr_ppg>
					<validation>inferred</validation>
					<pgType>Normal</pgType>
					<handSide>LEFT</handSide>
					<issue_id>softalkv4n11jul1984</issue_id>
					<validated_on>02/26/17 10:24:34 -0700</validated_on>
					<validator>Jim Salmons and Timlynn Babitsky</validator>
				</leaf>
				<leaf leafnum="23">
					<pageNum>21</pageNum>
					<ocr_ppg>None</ocr_ppg>
					<validation>inferred</validation>
					<pgType>Normal</pgType>
					<handSide>RIGHT</handSide>
					<issue_id>softalkv4n11jul1984</issue_id>
					<validated_on>02/26/17 10:24:35 -0700</validated_on>
					<validator>Jim Salmons and Timlynn Babitsky</validator>
				</leaf>
				<leaf leafnum="24">
					<pageNum>22</pageNum>
					<ocr_ppg>None</ocr_ppg>
					<validation>inferred</validation>
					<pgType>Normal</pgType>
					<handSide>LEFT</handSide>
					<issue_id>softalkv4n11jul1984</issue_id>
					<validated_on>02/26/17 10:24:37 -0700</validated_on>
					<validator>Jim Salmons and Timlynn Babitsky</validator>
				</leaf>
				<leaf leafnum="25">
					<pageNum>23</pageNum>
					<ocr_ppg>None</ocr_ppg>
					<validation>inferred</validation>
					<pgType>Normal</pgType>
					<handSide>RIGHT</handSide>
					<issue_id>softalkv4n11jul1984</issue_id>
					<validated_on>02/26/17 10:24:38 -0700</validated_on>
					<validator>Jim Salmons and Timlynn Babitsky</validator>
				</leaf>
				<leaf leafnum="26">
					<pageNum>24</pageNum>
					<ocr_ppg>24</ocr_ppg>
					<validation>printed</validation>
					<pgType>Normal</pgType>
					<handSide>LEFT</handSide>